### ISSUE TITLE
Cannot connect to 3270BBS with ajk's coax adapter

### ISSUE THREAD

**Issue by hanshuebner** [moshix/3270BBS#5]
I'm trying to connect to `www.moshix.tech:3270` using an IBM 3278 terminal connected to the Internet through [Andrew Kay's coax adapter](https://github.com/lowobservable/coax).  I can successfully connect to the VM/SP installation by SDF and to locally running Hercules running TSO using the hardware setup.  When connecting to `www.moshix.tech:3270`, however, no data exchange is performed between [oec](https://github.com/lowobservable/oec) and 3270BBS after the connection has been etablished.

Here's the tcpdump output from connecting to VM/IS:
```
08:40:01.278448 IP 192.168.2.120.50526 > 209.160.32.195.24: Flags [S], seq 3969583739, win 65535, options [mss 1460,nop,wscale 6,nop,nop,TS val 407656972 ecr 0,sackOK,eol], length 0
08:40:01.458298 IP 209.160.32.195.24 > 192.168.2.120.50526: Flags [S.], seq 30635148, ack 3969583740, win 2048, options [mss 536], length 0
08:40:01.458320 IP 192.168.2.120.50526 > 209.160.32.195.24: Flags [.], ack 1, win 65535, length 0
08:40:01.637677 IP 209.160.32.195.24 > 192.168.2.120.50526: Flags [P.], seq 1:4, ack 1, win 2048, length 3
08:40:01.637719 IP 192.168.2.120.50526 > 209.160.32.195.24: Flags [.], ack 4, win 65535, length 0
08:40:01.637943 IP 192.168.2.120.50526 > 209.160.32.195.24: Flags [P.], seq 1:4, ack 4, win 65535, length 3
08:40:01.825430 IP 209.160.32.195.24 > 192.168.2.120.50526: Flags [.], ack 4, win 2045, length 0
08:40:01.825430 IP 209.160.32.195.24 > 192.168.2.120.50526: Flags [P.], seq 4:10, ack 4, win 2045, length 6
08:40:01.825436 IP 192.168.2.120.50526 > 209.160.32.195.24: Flags [.], ack 10, win 65535, length 0
08:40:01.825659 IP 192.168.2.120.50526 > 209.160.32.195.24: Flags [P.], seq 4:22, ack 10, win 65535, length 18
08:40:02.004815 IP 209.160.32.195.24 > 192.168.2.120.50526: Flags [.], ack 22, win 2027, length 0
08:40:02.005364 IP 209.160.32.195.24 > 192.168.2.120.50526: Flags [P.], seq 10:22, ack 22, win 2027, length 12
08:40:02.005381 IP 192.168.2.120.50526 > 209.160.32.195.24: Flags [.], ack 22, win 65535, length 0
08:40:02.005592 IP 192.168.2.120.50526 > 209.160.32.195.24: Flags [P.], seq 22:25, ack 22, win 65535, length 3
08:40:02.182775 IP 209.160.32.195.24 > 192.168.2.120.50526: Flags [.], ack 25, win 2024, length 0
08:40:02.182799 IP 192.168.2.120.50526 > 209.160.32.195.24: Flags [P.], seq 25:34, ack 22, win 65535, length 9
08:40:02.360649 IP 209.160.32.195.24 > 192.168.2.120.50526: Flags [.], ack 34, win 2015, length 0
08:40:02.360649 IP 209.160.32.195.24 > 192.168.2.120.50526: Flags [P.], seq 22:37, ack 34, win 2015, length 15
08:40:02.360672 IP 192.168.2.120.50526 > 209.160.32.195.24: Flags [.], ack 37, win 65535, length 0
08:40:02.360919 IP 192.168.2.120.50526 > 209.160.32.195.24: Flags [P.], seq 34:37, ack 37, win 65535, length 3
08:40:02.543512 IP 209.160.32.195.24 > 192.168.2.120.50526: Flags [.], ack 37, win 2012, length 0
08:40:02.543532 IP 192.168.2.120.50526 > 209.160.32.195.24: Flags [P.], seq 37:137, ack 37, win 65535, length 100
08:40:02.726170 IP 209.160.32.195.24 > 192.168.2.120.50526: Flags [.], ack 137, win 1912, length 0
08:40:02.726170 IP 209.160.32.195.24 > 192.168.2.120.50526: Flags [P.], seq 37:573, ack 137, win 1912, length 536
08:40:02.726170 IP 209.160.32.195.24 > 192.168.2.120.50526: Flags [P.], seq 573:1109, ack 137, win 1912, length 536
08:40:02.726176 IP 192.168.2.120.50526 > 209.160.32.195.24: Flags [.], ack 1109, win 65535, length 0
08:40:02.904154 IP 209.160.32.195.24 > 192.168.2.120.50526: Flags [P.], seq 1109:1325, ack 137, win 1912, length 216
08:40:02.904171 IP 192.168.2.120.50526 > 209.160.32.195.24: Flags [.], ack 1325, win 65535, length 0
```
It can be seen that after the connection has been established, VM/SP sends 3 bytes.

When connecting to `www.moshix.tech:3270`, however, the server does not send anything when the connection established, and consequently no login screen is shown:
```
08:42:45.921110 IP 192.168.2.120.50547 > 35.192.26.118.3270: Flags [S], seq 669703385, win 65535, options [mss 1460,nop,wscale 6,nop,nop,TS val 2880971962 ecr 0,sackOK,eol], length 0
08:42:46.054835 IP 35.192.26.118.3270 > 192.168.2.120.50547: Flags [S.], seq 210895690, ack 669703386, win 32384, options [mss 1420,sackOK,TS val 4058013261 ecr 2880971962,nop,wscale 7], length 0
08:42:46.054856 IP 192.168.2.120.50547 > 35.192.26.118.3270: Flags [.], ack 1, win 2068, options [nop,nop,TS val 2880972096 ecr 4058013261], length 0
```

Is this something that needs fixing in oec, or is this an issue in 3270BBS?

Thank you for looking at this!
-Hans

**Comment by moshix** [comment]
Because Forum3270 is on port 2300 for terminal emulators and real terminals. www.moshix.tech:3270 (if you visit it wiht your browser) is a web-based emulator for people who don't have a terminal emulator. 

you have to connect to www.moshix.tech port 2300 with your oec. 

I use the oec every day and it works fine.
